{
  "schema": "sensor.report.v1",
  "tool": {
    "name": "builddiag",
    "version": "0.3.0"
  },
  "run": {
    "started_at": "2026-06-20T07:34:02.962809Z",
    "ended_at": "2026-06-20T07:34:03.888289100Z",
    "duration_ms": 925,
    "host": {
      "os": "windows",
      "arch": "x86_64"
    },
    "git": {
      "commit": "19ed65f87ee102d97d91c5a79dc46192d573f8cb",
      "branch": "add-fix-watch-hooks-crates",
      "dirty": true
    },
    "capabilities": {
      "checksums": {
        "status": "unavailable",
        "reason": "checksums file not found"
      },
      "config": {
        "status": "available"
      },
      "diff_aware": {
        "status": "skipped",
        "reason": "diff-aware mode not enabled"
      },
      "git": {
        "status": "available"
      },
      "toolchain": {
        "status": "unavailable",
        "reason": "rust-toolchain.toml not found"
      }
    }
  },
  "verdict": {
    "status": "pass",
    "counts": {
      "info": 0,
      "warn": 0,
      "error": 0,
      "suppressed": 0
    }
  },
  "findings": []
}