{
  "schema": "sensor.report.v1",
  "tool": {
    "name": "builddiag",
    "version": "0.2.0"
  },
  "run": {
    "started_at": "2026-02-06T21:19:30.134410800Z",
    "ended_at": "2026-02-06T21:19:30.156378Z",
    "duration_ms": 21,
    "host": {
      "os": "windows",
      "arch": "x86_64"
    },
    "git": {
      "commit": "4471821a5ec5041d366d86f91a8f2d717952966f",
      "branch": "main",
      "dirty": true
    },
    "capabilities": {
      "checksums": {
        "status": "unavailable",
        "reason": "checksums file not found"
      },
      "config": {
        "status": "available"
      },
      "diff_aware": {
        "status": "skipped",
        "reason": "diff-aware mode not enabled"
      },
      "git": {
        "status": "available"
      },
      "toolchain": {
        "status": "unavailable",
        "reason": "rust-toolchain.toml not found"
      }
    }
  },
  "verdict": {
    "status": "skip",
    "counts": {
      "info": 0,
      "warn": 0,
      "error": 0,
      "suppressed": 0
    },
    "reasons": [
      "all_checks_skipped"
    ]
  },
  "findings": []
}